{
  "generated_at_utc": "2026-02-21T16:39:03Z",
  "repo": "asdev-standards-platform",
  "compliance_score": 85.71,
  "checks": [
    {
      "name": "build",
      "status": "success",
      "source": "logs/verify.build.log"
    },
    {
      "name": "coverage",
      "status": "success",
      "source": "logs/verify.coverage.log"
    },
    {
      "name": "e2e",
      "status": "skipped",
      "source": "logs/verify.e2e.log"
    },
    {
      "name": "lint",
      "status": "success",
      "source": "logs/verify.lint.log"
    },
    {
      "name": "security-audit",
      "status": "success",
      "source": "logs/verify.security-audit.log"
    },
    {
      "name": "test",
      "status": "failed",
      "source": "logs/verify.test.log"
    },
    {
      "name": "typecheck",
      "status": "success",
      "source": "logs/verify.typecheck.log"
    }
  ]
}
